"ocid","id","rationale","budget_id","budget_description","budget_amount","budget_currency"
"ocds-5wno2w-SIE-RE-HIAL-011-2023-8458","SIE-RE-HIAL-011-2023-8458-2023-03-01T11:25:49.668Z","ADQUISICIÓN DE VORICONAZOL SOLIDO PARENTERAL 200MG CAJA X VIAL; PARA EL HOSPITAL GENERAL ISIDRO AYORA DE LOJA","","","",""
"ocds-5wno2w-SIE-RE-HIAL-013-2023-8458","SIE-RE-HIAL-013-2023-8458-2023-03-01T11:25:49.596Z","ADQUISICIÓN DE SULTAMICILINA (AMPICILINA + SULBACTAM) 375 MG Y 750 MG SOLIDO ORAL CAJA BLISTER-RISTRA, PARA EL HOSPITAL PROVINCIAL GENERAL ISIDRO AYORA.","","","",""
"ocds-5wno2w-SIE-RE-HPVC-001-2023-2443","SIE-RE-HPVC-001-2023-2443-2023-03-01T11:25:49.332Z","ADQUISICIÓN DE SOLUCIONES DESINFECTANTE (CLORHEXIDINA LIQUIDO CUTÁNEO 4por ciento, CLORHEXIDINA LIQUIDO CUTÁNEO 2por ciento , PARA PACIENTES QUE ACUDEN AL HOSPITAL PROVINCIAL DE PORTOVIEJO “DR. VERDI CEVALLOS BALDA","","","",""
"ocds-5wno2w-SIE-UTA-003-2023-3205","SIE-UTA-003-2023-3205-2023-03-01T11:25:49.256Z","Servicio de Radiofrecuencia Comunal Digital en Frecuencia VHF para 32 radios con la cual permite la comunicación al personal de Seguridad Universitaria y Dirección de Gestión de Riesgos de la Universidad Técnica de Ambato.","2023.176.9999.0000.01.00.000.012.000.1801.530105.000000.001.0000.0000","","",""
"ocds-5wno2w-CCD-EPMT-SD-002-2023-479584","CCD-EPMT-SD-002-2023-479584-2023-03-02T10:43:20.187Z-compiled","LEVANTAMIENTO DE LOS ELEMENTOS QUE CONFORMAN LA RED SEMAFÓRICA DEL CANTÓN SANTO DOMINGO DE LA EPMT-SD, INCLUYE ROTULACIÓN DE CÓDIGOS DE BIEN","320730601","","62008.93","USD"
"ocds-5wno2w-CCD-FIAIDMI-001-2023-237771","CCD-FIAIDMI-001-2023-237771-2023-03-02T10:43:43.831Z","CONTRATACIÓN DE UNA FIRMA AUDITORA EXTERNA PARA EXAMINAR LOS ESTADOS FINANCIEROS DEL FIDEICOMISO MERCANTIL DE INVERSIÓN Y ADMINISTRACIÓN DEL IESS PARA EL DESARROLLO DEL MERCADO INMOBILIARIO CORRESPONDIENTES AL EJERCICIO FISCAL DEL AÑO 2022","1.01.01.02.01.01","","1790.00","USD"
"ocds-5wno2w-CDC-ANDEC-003-23-467908","CDC-ANDEC-003-23-467908-2023-03-02T10:43:27.299Z-compiled","CONSULTORIA PARA EL DISEÑO, PRESUPUESTO DE OBRA, ESPECIFICACIONES TECNICAS, APU, METODOLOGIA DE TRABAJO, CRONOGRAMA DE TRABAJO Y CRONOGRAMA VALORADO OBRA CIVIL EN LAS CIMENTACIONES, PAVIMENTACIÓN EN PRENSA CIZALLA Y NAVE DE PROCESAMIENTO DE CHATARRA DE ANDEC S.A.","5192010901","","6400.00","USD"
"ocds-5wno2w-CDC-CBE-2023-001-320888","CDC-CBE-2023-001-320888-2023-03-02T10:43:43.378Z","SERVICIO DE CONSULTORÍA E INSTRUCCIÓN EN ATENCIÓN AL HERIDO EN EMERGENCIA DE FUEGO PARA EL PERSONAL OPERATIVO DEL CBE","53.06.12","","28000.00","USD"
"ocds-5wno2w-CDC-CBP-001-2023-49817","CDC-CBP-001-2023-49817-2023-03-02T10:43:23.910Z-compiled","CONSULTORÍA PARA LA CONSTATACIÓN FÍSICA, CONCILIACIÓN, IDENTIFICACIÓN Y ETIQUETADO DE TODOS LOS BIENES DE PROPIEDAD, PLANTA Y EQUIPO, BIENES DE CONTROL; Y, REVALORIZACIÓN DE LOS BIENES MUEBLES, DEL CUERPO DE BOMBEROS PORTOVIEJO","53.06.01","","23000.00","USD"
"ocds-5wno2w-CDC-CNT-6173-2023-236009","CDC-CNT-6173-2023-236009-2023-03-02T10:43:42.399Z","SERVICIOS DE CÁLCULO ACTUARIAL PARA EL CÓMPUTO DE LAS PROVISIONES DE JUBILACIÓN PATRONAL Y DESAHUCIO DEL PERSONAL ACTIVO Y JUBILADO DE LA CNT EP POR EL EJERCICIO ECONÓMICO 2022 SEGÚN LA NORMA CONTABLE NIC 19 (IAS 19 R)","20026","","6900.00","USD"
"ocds-5wno2w-CDC-CONAFIPS-04-2023-448191","CDC-CONAFIPS-04-2023-448191-2023-03-02T10:43:43.369Z","CONTRATACIÓN DE UNA CALIFICADORA DE RIESGOS PARA EL EJERCICIO ECONÓMICO 2023","45021010","","6900.00","USD"
"ocds-5wno2w-CDC-CONAGOPARE-04-23-101064","CDC-CONAGOPARE-04-23-101064-2023-03-02T10:43:43.857Z","Elaboración de un manual al código orgánico administrativo y a las normas de control interno de la contraloría desde la óptica jurídica aplicados al control interno y al cierre de procesos administrativos en los gobiernos autónomos descentralizados Parroquiales Rurales del País","730601","","25000.00","USD"
"ocds-5wno2w-CDC-EEAZ-001-2023-3203","CDC-EEAZ-001-2023-3203-2023-03-02T10:43:25.081Z-compiled","LA FISCALIZACIÓN DE LA OBRA SAPG CALIDAD – EXPANSIÓN VARIOS SECTORES (2022).","1.2.1.001.002","","9164.53","USD"
"ocds-5wno2w-CDC-EPAPAR-001-2023-384158","CDC-EPAPAR-001-2023-384158-2023-03-02T10:43:43.788Z","SERVICIO DE AUDITORIA EXTERNA PARA DICTAMINAR LA RAZONABILIDAD DE LOS ESTADOS FINANCIEROS DE LA EMPRESA PÚBLICA DE AGUA POTABLE Y ALCANTARILLADO DEL CANTÓN ROCAFUERTE EPAPAR, PARA EL EJERCICIO ECONOMICO TERMINADO AL 31 DE DICIEMBRE DEL AÑO 2022 Y DE LAS OPERACIONES ADMINISTRATIVAS FASES PREPARATORIA, PRE CONTRACTUAL Y CONTRACTUAL DE LOS PROCESOS DE CONTRATACIÓN DE LOS ÚLTIMOS 3 AÑOS.","530602","","6300.00","USD"
"ocds-5wno2w-CDC-EPMHVR-04-2023-734536","CDC-EPMHVR-04-2023-734536-2023-03-02T10:42:33.298Z-compiled","CONSULTORÍA PARA LA ELABORACIÓN DE LOS DISEÑOS ELÉCTRICOS Y DE CONECTIVIDAD DE LA FASE 1 DEL PROYECTO PLAN DE VIVIENDA DE INTERÉS SOCIAL EL ROSARIO","730601","","9980.00","USD"
"ocds-5wno2w-CDC-ESPOLTECH-01-23-375899","CDC-ESPOLTECH-01-23-375899-2023-03-02T10:43:43.601Z","CONTRATACIÓN DE SERVICIO DE AUDITORÍA EXTERNA PARA AUDITAR LOS ESTADOS FINANCIEROS DEL EJERCICIO FISCAL 2021 Y 2022 CORRESPONDIENTE AL PROYECTO “CO2-EOR PARA CCUS EN COLOMBIA Y ECUADOR – INICIATIVA ENERGÉTICA NORUEGA”.","530602","","2600.00","USD"
"ocds-5wno2w-CDC-FSDPYS-001-2023-772350","CDC-FSDPYS-001-2023-772350-2023-03-02T10:43:43.517Z","AUDITORÍA EXTERNA PARA EVALUAR LOS ESTADOS FINANCIEROS DEL FIDEICOMISO DEL SEGURO DE DEPÓSITOS DE LAS ENTIDADES DEL SECTOR FINANCIERO POPULAR Y SOLIDARIO DEL PERÍODO DE ENERO A DICIEMBRE DE 2022”","420000 420200","","10000.00","USD"
"ocds-5wno2w-CDC-GADICC-002-2023-94877","CDC-GADICC-002-2023-94877-2023-03-02T10:43:43.541Z","CONTRATACIÓN DE LA CONSULTORÍA PARA LA ELABORACIÓN DEL ESTUDIO DE FACTIBILIDAD Y DISEÑO FINAL DEL RESERVORIO COMUNITARIO DE LA COOPERATIVA AGROPECUARIA CAÑAR CAPAK QUILLOAC DE LA PARROQUIA Y CANTÓN CAÑAR.","7.3.331.06.05","","15000.00","USD"
"ocds-5wno2w-CDC-GADMCB-003-2023-91641","CDC-GADMCB-003-2023-91641-2023-03-02T10:43:29.080Z-compiled","FISCALIZACION DE LA CONSTRUCCION DE LA SEGUNDA ETAPA DEL MALECÓN DE BABA CON AREAS DEPORTIVAS Y OBRAS COMPLEMENTARIAS EN LA CIUDADELA BELLAVISTA DEL CANTÓN BABA DE LA PROVINCIA DE LOS RIOS","73.06.04","","56175.51","USD"
"ocds-5wno2w-CDC-GADMLT-001-2023-2670","CDC-GADMLT-001-2023-2670-2023-03-02T10:43:32.221Z-compiled","FISCALIZACIÓN DE LA CONSTRUCCIÓN DEL SISTEMA DE AGUA POTABLE DE LA ZONA URBANA DE LA CIUDAD DE LA TRONCAL I ETAPA","3675010107","","62900.94","USD"
"ocds-5wno2w-CDC-GADMUR-001-2023-2485","CDC-GADMUR-001-2023-2485-2023-03-02T10:43:43.198Z","MEJORAMIENTO Y MANTENIMIENTO DE EQUIPAMIENTOS DEPORTIVOS Y ÁREAS RECREATIVAS – ESTUDIO DE PATOLOGÍAS Y SUELOS","73.06.05","","20200.00","USD"
"ocds-5wno2w-CDC-GADPLLA-002-2023-130071","CDC-GADPLLA-002-2023-130071-2023-03-02T10:43:43.588Z","ELABORACION DE LOS DISEÑOS GEOMETRICOS, DISEÑOS DE PAVIMENTOS, DISEÑO DE OBRAS DE DRENAJE Y LEVANTAMIENTOS TOPOGRAFICOS PARA EL MEJORAMIENTO DE VARIAS VIAS DE LA PARROQUIA LLACAO, CANTON CUENCA, PROVINCIA DEL AZUAY","73.06.01","","20300.00","USD"
"ocds-5wno2w-RECSCD-GADMIS-004-23-24339","RECSCD-GADMIS-004-23-24339-2023-03-02T10:43:33.845Z-compiled","CONTRATACIÓN DE TRANSMISIÓN EN VIVO DE DIVERSOS ACONTECIMIENTOS DE MAYOR RELEVANCIA DE LA MUNICIPALIDAD Y CONTRATACIÓN PARA LA ELABORACIÓN DE SPOTS EN AUDIO Y VIDEO DE LOS PRINCIPALES ATRACTIVOS Y MANIFESTACIONES DEL CANTÓN","5.3.02.07","","8370.00","USD"
"ocds-5wno2w-CDC-GADPRC-07-2023-284080","CDC-GADPRC-07-2023-284080-2023-03-02T10:43:43.501Z","ESTUDIO Y DISEÑO DE PROYECTO PARA LA CONSTRUCCIÓN DEL PARQUE RECREATIVO PARA LA COMUNA MANANTIAL DE COLONCHE DE LA PARROQUIA COLONCHE, CANTÓN SANTA ELENA, PROVINCIA DE SANTA ELENA","730605","","6000.00","USD"
"ocds-5wno2w-CDC-GADPRC-08-2023-284080","CDC-GADPRC-08-2023-284080-2023-03-02T10:43:43.781Z","ESTUDIOS Y DISEÑOS DE PROYECTOS PARA LA CONSTRUCCION DE LA HOSPEDERIA COMUNITARIA AYANGUE EN LA COMUNA AYANGUE, HOSPEDERIA COMUNITARIA LOMA ALTA EN LA COMUNA LOMA ALTA Y HOSPEDERIA COMUNITARIA SALANGUILLO EN LA COMUNA SALANGUILLO DE LA PARROQUIA COLONCHE, CANTON SANTA ELENA PROVINCIA DE SANTA ELENA","730605","","15000.00","USD"
"ocds-5wno2w-CDC-GADPRM-001-2023-316635","CDC-GADPRM-001-2023-316635-2023-03-02T10:43:33.297Z","Estudios para la construcción de área recreativa en el sector Las Palmeras de la Comuna Olón, Parroquia Manglaralto, Cantón Santa Elena, Provincia de Santa Elena, así como la construcción de letras corpóreas identificativas de la comuna (Atravezado) Libertador Bolívar - Comuna La Rinconada, Parroquia Manglaralto, Cantón Santa Elena, Provincia de Santa Elena.","730605","","8310.00","USD"
"ocds-5wno2w-CDC-GADPRM-002-2023-316635","CDC-GADPRM-002-2023-316635-2023-03-02T10:43:43.924Z","Fiscalización de la obra PROYECTO: “CONSTRUCCION DE LA HOSPEDERIA COMUNITARIA EN LA COMUNA SAN PEDRO DE LA PARROQUIA MANGLARALTO, CANTON SANTA ELENA, PROVINCIA DE SANTA ELENA","730604","","6811.63","USD"
"ocds-5wno2w-CDC-UNEMI-032-2023-43664","CDC-UNEMI-032-2023-43664-2023-03-02T10:43:43.608Z","Contratación de los servicios de consultoría para auditoría externa a los estados financieros del ejercicio económico 2022, de la UNIVERSIDAD ESTATAL DE MILAGRO, para el cumplimiento del carácter no lucrativo.","2023.181.0000.0000.01.00.000.001.000.0910.530602.000000.001.0000.0000","","14929.20","USD"
"ocds-5wno2w-COTBS-EXP-001-2023-486771","COTBS-EXP-001-2023-486771-2023-03-02T10:43:43.868Z","SERVICIO INTEGRAL DE OPERADOR LOGÍSTICO INCLUIDO TRANSPORTE INTERNO DE MATERIA PRIMA Y PRODUCTO TERMINADO IMPORTADO Y EXPORTADO POR LA EMPRESA EXPLOCEN C.A.","5193","","330000.00","USD"
"ocds-5wno2w-COTO-GADMCP-01-23-63260","COTO-GADMCP-01-23-63260-2023-03-02T10:43:43.531Z","CONSTRUCCIÓN DE ACERAS, BORDILLOS Y CALZADA ASFÁLTICA DE 2” EN LA CALLE ELVA ALCÍVAR, CALLE BELLAVISTA, CALLE SILVIO CEDEÑO-SIMÓN CRESPO CASANOVA, CALLE LOS FICUS, CALLE NUEVA DESDE EL BARRIO BUENOS AIRES HASTA EL BARRIO SAN PEDRO, CALLE LA PAZ DE LA PARROQUIA SAN SEBASTIÁN, CALLE DEL BARRIO SAN PABLO; Y AMPLIACIÓN DE CALZADA ASFÁLTICA DE 2” EN LA CALLE HIGUERÓN DESDE EL PUENTE HIGUERÓN HASTA LA AVENIDA BOLÍVAR LÓPEZ, DEL CANTÓN PICHINCHA","75.01.05","","452786.01","USD"
"ocds-5wno2w-COTO-GADMCPVM-01-23-27797","COTO-GADMCPVM-01-23-27797-2023-03-02T10:43:43.559Z","SUMINISTRO Y COLOCACIÓN DE CARPETA ASFÁLTICA EN LOS BARRIOS TAMAYO Y LOS PINOS DE LA CABECERA CANTONAL Y ALGUNAS CALLES DEL SECTOR SUR DEL CENTRO POBLADO DEL RECINTO LA CELICA - SEGUNDA ETAPA.","75.01.05","","340646.09","USD"
"ocds-5wno2w-COTO-PINAS-01-2023-33182","COTO-PINAS-01-2023-33182-2023-03-02T10:42:44.811Z-compiled","CONSTRUCCION DE ACERA Y CICLO VIA, EN LA AV. ÁNGEL SALVADOR OCHOA, OBRA CIVIL (COSTADO SUR) CUARTA ETAPA - L=907 m - DESDE; LA ABSCISA 2+813.17 HASTA LA ABSCISA 3+720.00, A LA “Y” DEL PORTETE; DEL CANTON PIÑAS, PROVINCIA DE EL ORO","7.5.01.05.08","","416516.85","USD"
"ocds-5wno2w-COTS-CONAGOPARE-1-23-101064","COTS-CONAGOPARE-1-23-101064-2023-03-02T10:43:43.697Z","“ADQUIRIR PASAJES AL EXTERIOR PARA EL CUMPLIMIENTO DE ACTIVIDADES EN REPRESENTACIÓN DE LA INSTITUCIÓN PARA AUTORIDADES Y FUNCIONARIOS DE CONAGOPARE NACIONAL E INSTANCIAS DESCONCENTRADAS PROVINCIALES DELEGACIONES”","730302","","71280.85","USD"
"ocds-5wno2w-COTS-CZ4S-001-2023-479937","COTS-CZ4S-001-2023-479937-2023-03-02T10:43:43.215Z","CONTRATACION DEL SERVICIO DE MANTENIMIENTO INTEGRAL DE VEHICULOS DE LA COORDINACION ZONAL 4","2023.320.0054.0000.01.00.000.001.000.1301.530405.000000.001.0000.0000","","150879.60","USD"
"ocds-5wno2w-LCC-EEQ-GD001-2023-3214","LCC-EEQ-GD001-2023-3214-2023-03-02T10:43:43.553Z","CONSULTORÍA PARA DISEÑO DE REPOTENCIACIÓN DE REDES E INCREMENTO DE CALIDAD EN 4 SECTORES DENTRO DEL ÁREA DE SERVICIO DE LA EMPRESA ELÉCTRICA QUITO-NOROESTE","121038512170260225","","269373.99","USD"
"ocds-5wno2w-LICS-AGP-001-2023-462963","LICS-AGP-001-2023-462963-2023-03-02T10:43:42.706Z","CONTRATACIÓN DE POLIZAS DE SEGURO DE MULTIRIESGO QUE INCLUYE INCENDIO Y/O RAYO, EXPLOSION, TERREMOTO, EVENTOS CATASTROFICOS NATURALES, INUNDACIONES, MOTIN, HUELGA, INCENDIO, ROBO, ASALTO, HURTO, ROTURA DE MAQUINA, EQUIPOS ELECTRONICOS, DINERO, VALORES EN PERMANENCIA E INVENTARIOS DE BODEGA Y DE RESPONSABILIDAD CIVIL PARA AGUAPEN-EP","200.000.570201","","184871.57","USD"
"ocds-5wno2w-LICS-CBCM-001-2023-96969","LICS-CBCM-001-2023-96969-2023-03-02T10:43:42.691Z","CONTRATACIÓN DE UNA PÓLIZA DE SEGURO DE VIDA Y ACCIDENTESPARA EL PERSONAL DEL CUERPO DE BOMBEROS DEL CANTÓN MORONA","57.02.01","","10000.00","USD"
"ocds-5wno2w-LICS-CBT-002-2023-142333","LICS-CBT-002-2023-142333-2023-03-02T10:43:43.427Z","CONTRATACION DE POLIZAS DE SEGUROS PARA INCENDIO Y LINEAS ALIADAS, ROBO Y/O ASALTO, EQUIPO ELECTRONICO, ROTURA DE MAQUINARIA, CASCO AEREO, VIDA Y ACCIDENTE PERSONALES DEL CUERPO DE BOMBEROS DE TULCAN","570201","","12804.01","USD"
"ocds-5wno2w-LICS-CEMA-001-2023-29813","LICS-CEMA-001-2023-29813-2023-03-02T10:43:43.471Z","SERVICIO DE TRANSPORTE DE GLP EN CILINDROS OPERATIVOS HACIA LOS DISTRIBUIDORES DE LA CEM AUSTROGAS","630202","","1000558.94","USD"
"ocds-5wno2w-LICS-GADMCT-001-2023-54709","LICS-GADMCT-001-2023-54709-2023-03-02T10:43:43.901Z","CONTRATACIÓN DE POLIZAS DE SEGURO DE INCENDIO TODO RIESGO, ROBO, EQUIPO ELECTRONICO, ROTURA DE MAQUINARIA, VEHICULOS, FIDELIDAD, EQUIPO MAQUINARIA PARA EL GOBIERNO AUTONOMO DESCENTRALIZADO DEL CANTON TOSAGUA","00.00.E500.510.570201.102.13.15.50.A00.99.99.99.99","","64352.41","USD"
"ocds-5wno2w-LICSG-GADPP-1-2023-2426","LICSG-GADPP-1-2023-2426-2023-03-02T10:43:40.890Z","Póliza de Seguros de Vida en Grupo para el Personal de Obreros sujetos al Código de Trabajo del Gobierno Autónomo Descentralizado de la Provincia de Pichincha","01.29.00.351.000.2023.570201.001.17.01.03.A30.9999","","60190.08","USD"
"ocds-5wno2w-MCBS-EPCOTSA-01-2023-432323","MCBS-EPCOTSA-01-2023-432323-2023-03-02T10:43:41.610Z","CONTRATACIÓN DE EVENTOS CULTURALES PARA LOS PROYECTOS SOCIALES.","20.01.7.73.02.05","","30000.00","USD"
"ocds-5wno2w-MCBS-GADMCEL-01-2023-2792","MCBS-GADMCEL-01-2023-2792-2023-03-02T10:43:19.644Z-compiled","“FABRICACIÓN Y MONTAJE DE LA CUBIERTA DE ESTRUCTURA METÁLICA PARA EL BARRIO DEFENSA CIVIL, PARROQUIA CELICA, CANTÓN CELICA, PROVINCIA DE LOJA”","3.6.1.7.3.04.02","","8440.96","USD"
"ocds-5wno2w-MCBS-GADMCEL-02-2023-2792","MCBS-GADMCEL-02-2023-2792-2023-03-02T10:43:30.663Z-compiled","“FABRICACIÓN Y MONTAJE DE LAS CUBIERTAS DE ESTRUCTURA METÁLICA PARA LA CANCHA SINTÉTICA DEL BARRIO URBANO REINA DEL CISNE Y COLEGIO TNTE. MAXIMILIANO RODRIGUEZ, PARROQUIA POZUL, CANTÓN CELICA, PROVINCIA DE LOJA”","3.6.1.7.3.04.02","","16881.92","USD"
"ocds-5wno2w-MCBS-GADMSB-02-2023-28501","MCBS-GADMSB-02-2023-28501-2023-03-02T10:43:41.980Z","SERVICIO DE MANTENIMIENTO PREVENTIVO, CORRECTIVO CON LA ADQUISICIÓN DE REPUESTOS Y ACCESORIOS, PARA LAS MAQUINARIAS DEL CENTRO DE FAENAMIENTO MUNICIPAL DEL CANTÓN SIMÓN BOLÍVAR","530404 530803 530813","","14500.00","USD"
"ocds-5wno2w-MCBS-GADPH-01-2023-117483","MCBS-GADPH-01-2023-117483-2023-03-02T10:42:47.191Z-compiled","CONSTRUCCION DE UN BAR EN EL SECTOR EL TESORO PERTENECIENTE A LA PARROQUIA HUAMBI","75.01.07.03","","13354.89","USD"
"ocds-5wno2w-MCO-DMQ-AZQ-02-2023-41357","MCO-DMQ-AZQ-02-2023-41357-2023-03-02T10:43:42.540Z","INTERVENCION VIAL 1 VARIOS BARRIOS DE LA PARROQUIA CHILLOGALLO","750105","","145280.17","USD"
"ocds-5wno2w-MCO-DMQ-AZQ-03-2023-41357","MCO-DMQ-AZQ-03-2023-41357-2023-03-02T10:43:42.739Z","INTERVENCION VIAL 1 VARIOS BARRIOS DE LA PARROQUIA TURUBAMBA","750105","","180094.01","USD"
"ocds-5wno2w-MCO-GAD10A-2023-001-483969","MCO-GAD10A-2023-001-483969-2023-03-02T10:43:41.711Z","CONSTRUCCIÓN DE UNA CANCHA SINTETICA, EN EL AREA VERDE DEL RECINTO EL CONDOR, PARROQUIA 10 DE AGOSTO, CANTÓN LAGO AGRIO, PROVINCIA DE SUCUMBIOS","750107.02.01.003.006.01.12.001.001.0002","","66924.42","USD"
"ocds-5wno2w-MCO-GADBOL-001-2023-24744","MCO-GADBOL-001-2023-24744-2023-03-02T10:43:42.923Z","CONSTRUCCIÓN DE ADOQUINADO EN EL BARRIO CENTRAL DE LA AV. SAN LORENZO DE LA CIUDAD DE CALCETA, CANTÓN BOLÍVAR, PROVINCIA DE MANABÍ“,","360.75.01.05","","16484.61","USD"
"ocds-5wno2w-MCO-GADBOL-002-2023-24744","MCO-GADBOL-002-2023-24744-2023-03-02T10:43:42.962Z","CONSTRUCCIÓN DE ADOQUINADO EN CALLES TRANSVERSALES DE UN SECTOR DEL BARRIO LA JUANITA DE LA CIUDAD DE CALCETA, CANTÓN BOLÍVAR, PROVINCIA DE MANABÍ“,","360.75.01.05","","36999.75","USD"
"ocds-5wno2w-MCO-GADMCA-01-2023-3680","MCO-GADMCA-01-2023-3680-2023-03-02T10:43:42.562Z","MEJORAMIENTO DEL SISTEMA DE AGUA DE CONSUMO HUMANO DE LA CABECERA PARROQUIAL DE SEVILLA, CANTÓN ALAUSÍ","75.01.01.2023.310.004.007.00D","","45722.72","USD"
"ocds-5wno2w-MCO-GADMCLC-001-2023-131152","MCO-GADMCLC-001-2023-131152-2023-03-02T10:43:41.833Z","CONSTRUCCIÓN DE PARQUES","360.7.5.01.04.22","","123994.91","USD"
"ocds-5wno2w-MCO-GADMD-002-2023-82809","MCO-GADMD-002-2023-82809-2023-03-02T10:43:24.500Z-compiled","Construcción de un ramal de alcantarillado sanitario para la comunidad Sigsipamba","75,01,03","","43937.09","USD"
"ocds-5wno2w-MCO-GADMEA-001-2023-175195","MCO-GADMEA-001-2023-175195-2023-03-02T10:43:41.719Z","REMEDIACIÓN DEL CIERRE TÉCNICO DEL BOTADERO DE BASURA DE LA PARROQUIA BORBÓN, CANTÓN ELOY ALFARO ELOY ALFARO","7.5.3.1.1.01.07.01.11","","177444.48","USD"
"ocds-5wno2w-MCO-GADMIPA-01-2023-30228","MCO-GADMIPA-01-2023-30228-2023-03-02T10:43:42.743Z","PLAZA GASTRONÓMICA, ARTESANÍAS Y COMERCIO MENOR EN LA CIUDAD DE ARAJUNO, PROVINCIA DE PASTAZA CANTÓN ARAJUNO, PROVINCIA DE PASTAZA","360.75.01.07.083","","168458.86","USD"
"ocds-5wno2w-MCO-GADMIS-002-2023-24339","MCO-GADMIS-002-2023-24339-2023-03-02T10:43:41.780Z","CONSTRUCCIÓN DE LA CUBIERTA METÁLICA EN LA CANCHA DE USO MÚLTIPLE DE LA PARROQUIA TABLÓN DEL CANTÓN SARAGURO PROVINCIA DE LOJA","7.5.351.5.01.07.04","","76548.08","USD"
"ocds-5wno2w-MCO-GADMLA-004-2023-91040","MCO-GADMLA-004-2023-91040-2023-03-02T10:43:42.019Z","CONSTRUCCIÓN DE LA CASA COMEDOR EN LA ESCUELA FRANCISCO MIRANDA DEL RECINTO ABDÓN CALDERÓN DE LA PARROQUIA JAMBELÍ","75.01.07.10","","57271.07","USD"
"ocds-5wno2w-MCO-GADMLA-005-2023-91040","MCO-GADMLA-005-2023-91040-2023-03-02T10:43:42.305Z","CONSTRUCCIÓN DE LOCALES PARA EL COMERCIO A ORILLAS DEL RÍO ENO, EN LA CABECERA PARROQUIAL EL ENO, PARROQUIA EL ENO, CANTÓN LAGO AGRIO","75.01.07.01","","56375.92","USD"
"ocds-5wno2w-MCO-GADMSFP-01-2023-31732","MCO-GADMSFP-01-2023-31732-2023-03-02T10:43:42.769Z","CONSTRUCCIÓN DE ALCANTARILLADO PLUVIAL, UBICADO EN EL SECTOR DEL CEMENTERIO GENERAL DE PUERTO PECHICHE DE LA PARROQUIA RURAL PUERTO PECHICHE CANTÓN SAN FRANCISCO DE PUEBLOVIEJO PROVINCIA DE LOS RIOS","7.5.01.03.01","","21400.26","USD"
"ocds-5wno2w-MCO-GADMSUC-01-2023-42986","MCO-GADMSUC-01-2023-42986-2023-03-02T10:43:42.431Z","CONSTRUCCIÓN DE OFICINA EN LA SEDE DE LA ASOCIACIÓN DE MINUSVÁLIDOS DEL CANTÓN SUCÚA","00.00.F300.36.750107.103.000","","20071.81","USD"
"ocds-5wno2w-MCO-GADMZ-002-2023-21867","MCO-GADMZ-002-2023-21867-2023-03-02T10:43:41.795Z","REPOTENCIACIÓN DEL CAMAL MUNICIPAL, UBICADO EN LA PARROQUIA CUMBARATZA, CANTÓN ZAMORA, PROVINCIA DE ZAMORA CHINCHIPE","750501003","","59998.47","USD"
"ocds-5wno2w-MCO-GADPAJAN-04-2023-140482","MCO-GADPAJAN-04-2023-140482-2023-03-02T10:43:41.414Z","CONSTRUCCION DE GALPON EN AREA DE VENTA DE CARNICOS SITIO EL SOMBRERO DE LA PARROQUIA CASCOL","75.05.01","","10460.10","USD"
"ocds-5wno2w-MCO-GADPAJAN-05-2023-140482","MCO-GADPAJAN-05-2023-140482-2023-03-02T10:43:41.553Z","REMODELACION CEMENTERIO DE LA  PARROQUIA GUALE DEL CANTON PAJAN","75.01.04","","44499.33","USD"
"ocds-5wno2w-MCO-GADPC-02-2023-54001","MCO-GADPC-02-2023-54001-2023-03-02T10:43:42.584Z","COLOCACION DE CARPETA ASFALTICA E 5 CMS, CALLE 24 DE SEPTIEMBRE DESDE CALLE CENEPA HASTA CALLE SANTA ROSA Y CALLE SANTA ROSA DESDE CALLE 24 DE SEPTIEMBRE HASTA AV. 7 DE AGOSTO, DEL SECTOR BUENA FE PERTENECIENTE A LA PARROQUIA SABANILLA DEL CANTON PEDRO CARBO","750501040431100","","109999.15","USD"
"ocds-5wno2w-MCO-GADPLUQ-004-2023-141370","MCO-GADPLUQ-004-2023-141370-2023-03-02T10:43:42.371Z","CONSTRUCCIÓN DE CUBIERTA METÁLICA EN CANCHA DE USO MÚLTIPLE EN LA CIUDADELA MIDUVI MILAGRO DE DIOS","750104","","86199.34","USD"
"ocds-5wno2w-MCO-GADPN-002-2023-58415","MCO-GADPN-002-2023-58415-2023-03-02T10:43:42.547Z","CONSTRUCCION DEL PUENTE SOBRE EL RIO UKTU YACU, AROSEMENA TOLA","40.01.003.001.750105.014.15.01.000.99.99.99.99.001","","26681.44","USD"
"ocds-5wno2w-MCO_GADPRC_01_23-100200","MCO_GADPRC_01_23-100200-2023-03-02T10:42:46.404Z-compiled","MANTENIMIENTO Y OTROS DEL COLISEO CENTRAL DE LA PARROQUIA COTALÓ","7.3.04.17","","37966.41","USD"
"ocds-5wno2w-MCO-GADPRP-003-2023-529814","MCO-GADPRP-003-2023-529814-2023-03-02T10:43:41.119Z","CONSTRUCCIÓN DE INFRAESTRUCTURA PARA LA CASCADA LAS TRILLIZAS, PERTENECIENTE A LA RUTA TURÍSTICA LOS TEPUYES, EN LA PARROQUIA RURAL DE PANGUINTZA, CANTÓN CENTINELA DEL CÓNDOR, PROVINCIA DE ZAMORA CHINCHIPE","750104","","40596.87","USD"
"ocds-5wno2w-MCO-GADPRP-02-2023-114436","MCO-GADPRP-02-2023-114436-2023-03-02T10:43:42.058Z","AMPLIACION Y MEJORA DE REDES ELECTRICAS. NUKANTAI CENTRO","75050401","","19142.98","USD"
"ocds-5wno2w-MCO-GADPRZ-001-2023-119330","MCO-GADPRZ-001-2023-119330-2023-03-02T10:43:42.112Z","MEJORAMIENTO Y MANTENIMIENTO DE LA INFRAESTRUCTURA FISICA DE LA UNIDAD EDUCATIVA VICTOR HUGO ABAD DE LA PARROQUIA ZHUD.","7501050","","72928.89","USD"
"ocds-5wno2w-MCO-GADPZCH-001-2023-68478","MCO-GADPZCH-001-2023-68478-2023-03-02T10:43:42.657Z","Construcción de un puente peatonal en el sector La Libertad del barrio Tunantza Alto, parroquia Timbara, cantón Zamora","44.750105.143.0010","","22056.20","USD"
"ocds-5wno2w-MCO-GADPZCH-006-2023-68478","MCO-GADPZCH-006-2023-68478-2023-03-02T10:43:41.530Z","Construcción de piso y cubierta para fomento productivo en el barrio El Tablón, parroquia Zumba, cantón Chinchipe","33.750107.123.0002","","103723.52","USD"
"ocds-5wno2w-MCO-GADSA-002-2023-112263","MCO-GADSA-002-2023-112263-2023-03-02T10:43:41.689Z","REPOTENCIACIÓN E INSTALACION DE MAQUINARIAS PARA EL CENTRO DE ACOPIO Y PROCESAMIENTO DE MAÍZ DE LA COMUNIDAD BARQUERO DE LA PARROQUIA SAN ANTONIO DEL CANTÓN CHONE DE LA PROVINCIA DE MANABÍ","750104","","105580.00","USD"
"ocds-5wno2w-MCO-GADSOZO-01-2023-171157","MCO-GADSOZO-01-2023-171157-2023-03-02T10:43:41.801Z","RESTAURACIÓN DE BIENES INMUEBLES. PATRIMONIO CULTURAL. PISCINA MUNICIPAL","351.75.01.07.20","","219872.89","USD"
"ocds-5wno2w-MCO-IMSE-002-2023-4081","MCO-IMSE-002-2023-4081-2023-03-02T10:43:42.897Z","MANTENIMIENTO DEL PARTERRE CENTRAL DE LA AV. FRANCISCO PIZARRO DEL CANTON SANTA ELENA, PROVINCIA DE SANTA ELENA","750104","","173612.92","USD"
"ocds-5wno2w-MCO-UTAEP-2023-001-708053","MCO-UTAEP-2023-001-708053-2023-03-02T10:43:41.320Z","EJECUCIÓN DE OBRA CIVIL, REMODELACIÓN, MANTENIMIENTO Y ADECUACIÓN DEL COMPLEJO  DEPORTIVO ACUÁTICO DE LA UNIVERSIDAD TÉCNICA DE AMBATO","631407","","153882.34","USD"
"ocds-5wno2w-MCS-APM-001-2023-2477","MCS-APM-001-2023-2477-2023-03-02T10:43:40.150Z","Servicio de Limpieza y Evacuación de aguas residuales de los pozos sépticos de Autoridad Portuaria de Manta","2023.102.0000.0000.77.00.000.001.000.1308.530209.000000.002.0000.0000","","7935.00","USD"
"ocds-5wno2w-MCS-CBQ-001-2023-84032","MCS-CBQ-001-2023-84032-2023-03-02T10:43:39.450Z","ADQUISICION DE COMBUSTIBLE PARA EL ABASTECIMIENTO DEL PARQUE AUTOMOTOR PERTENECIENTE AL CUERPO DE BOMBEROS QUININDE","530803","","13392.68","USD"
"ocds-5wno2w-MCS-COIMC-001-2023-740377","MCS-COIMC-001-2023-740377-2023-03-02T10:43:40.539Z","CONTRATACIÓN DEL SERVICIO DE PASAJES AÉREOS AL INTERIOR, PARA EL  COMANDO DE INTELIGENCIA MILITAR CONJUNTO (COIMC) Y UNIDADES SUBORDINADAS AÑO 2023","2023.070.4004.0000.55.00.000.001.000.1701.530301.000000.001.0000.0000","","16071.43","USD"
"ocds-5wno2w-MCS-DNPJ-06-2023-183304","MCS-DNPJ-06-2023-183304-2023-03-02T10:43:39.275Z","Contratación del servicio de abastecimiento de combustible de la Policía Judicial Subzona Pichincha y Unidades Nacionales Especializadas.","2023.057.0000.0000.91.00.000.001.000.1701.530255.000000.001.0000.0000","","11856.48","USD"
"ocds-5wno2w-MCS-DNPJ-07-2023-183304","MCS-DNPJ-07-2023-183304-2023-03-02T10:43:39.283Z","Contratación para el servicio de abastecimiento de combustible para la Policía Judicial Distritos: Durán, Samborondón y Progreso.","2023.057.0000.0000.91.00.000.001.000.1701.530255.000000.001.0000.0000","","7981.46","USD"
"ocds-5wno2w-MCS-EEAZ-001-2023-3203","MCS-EEAZ-001-2023-3203-2023-03-02T10:43:41.965Z","SERVICIO DE MECÁNICA AUTOMOTRIZ PARA EL MANTENIMIENTO PREVENTIVO Y CORRECTIVO DE LOS VEHÍCULOS LIVIANOS DEL PARQUE AUTOMOTOR DE LA EMPRESA ELÉCTRICA AZOGUES C.A 2023.","5.2.1.002.001","","12611.00","USD"
"ocds-5wno2w-MCS-GADMD-002-2023-82809","MCS-GADMD-002-2023-82809-2023-03-02T10:43:39.968Z","Contratación de servicios de organización y logística para la realización de eventos culturales, sociales, turísticos y deportivos por la conmemoración de los XXXI años de cantonización de Déleg.","53,02,05","","40000.00","USD"
"ocds-5wno2w-MCS-GADMUPAN-03-2023-45119","MCS-GADMUPAN-03-2023-45119-2023-03-02T10:43:42.591Z","CONTRATACION DE SERVICIOS ESPECIALIZADOS DE NOTIFICADOR PARA LA RECUPERACION DE CARTERA VENCIDA DE IMPUESTOS Y TASAS DEL GAD MUNICIPAL DE PANGUA","1.1.0.5.3.06.06","","7704.80","USD"
"ocds-5wno2w-MCS-MIES-DDR-01-2023-20799","MCS-MIES-DDR-01-2023-20799-2023-03-02T10:43:40.305Z","CONTRATACION DEL SERVICIO DE MANTENIMIENTO PREVENTIVO Y CORRECTIVO DEL PARQUE AUTOMOTOR DISTRITAL RIOBAMBA","2023.280.3310.0000.01.00.000.001.000.0601.530405.000000.001.0000.0000","","11638.99","USD"
"ocds-5wno2w-MCS-SZO-003-2023-179196","MCS-SZO-003-2023-179196-2023-03-02T10:43:39.385Z","ABASTECIMIENTO DE COMBUSTIBLE DE VEHÍCULOS POLICIALES DEL DISTRITO ZARUMA","2023.052.0050.0000.01.00.000.001.000.0701.530255.000000.001.0000.0000","","34374.58","USD"
