"ocid","id","rationale","budget_id","budget_description","budget_amount","budget_currency"
"ocds-5wno2w-SIE-HPDA-022-2023-2728","SIE-HPDA-022-2023-2728-2023-02-24T10:52:21.747Z","CONTRATACIÓN DEL MANTENIMIENTO DE LOS SISTEMAS DE CLIMATIZACIÓN Y VENTILACIÓN MECÁNICA, INCLUYE CAMBIO DE FILTROS DE LOS EQUIPOS Y LIMPIEZA DEL SISTEMA DE DUCTERIA DEL HOSPITAL GENERAL DOCENTE AMBATO","2023.320.1460.0000.57.00.000.002.000.1801.530404.000000.001.0000.0000","","",""
"ocds-5wno2w-SIE-HRZ-2023-001-10269","SIE-HRZ-2023-001-10269-2023-02-24T10:52:22.279Z","ADQUISICIÓN DE DISPOSITIVOS  MÉDICOS DE USO GENERAL PARA EL AÑO 2023 DE HOSPITAL RODRÍGUEZ  ZAMBRANO DE MANTA","2023.320.1331.0000.90.00.000.003.000.1308.530826.000000.001.0000.0000","","",""
"ocds-5wno2w-SIE-HSCJ-001-2023-68807","SIE-HSCJ-001-2023-68807-2023-02-24T10:52:21.955Z","ADQUISICION DE OXIGENO GAS MEDICINAL PARA EL ABASTECIMIENTO AL HOSPITAL SAGRADO CORAZON DE JESUS QUEVEDO","2023.320.1302.0000.90.00.000.004.000.1205.530809.000000.001.0000.0000","","",""
"ocds-5wno2w-SIE-HSLO-001-2023-2580","SIE-HSLO-001-2023-2580-2023-02-24T10:52:21.904Z","ADQUISICIÓN DE FORMULARIOS DE HISTORIA CLINICA FÍSICA PARA EL HOSPITAL SAN LUIS DE OTAVALO","2023.320.1256.0000.90.00.000.004.000.1004.530807.000000.001.0000.0000","","",""
"ocds-5wno2w-SIE-IESSMANTA-003-23-74622","SIE-IESSMANTA-003-23-74622-2023-02-24T10:52:21.647Z","ADQUISICIÓN DE MEDICAMENTOS DEL GRUPO B SANGRE Y ÓRGANOS FORMADORES DE LA SANGRE PARA EL HOSPITAL GENERAL MANTA","530809","","",""
"ocds-5wno2w-SIE-MDMQ-SIS-02-2023-41357","SIE-MDMQ-SIS-02-2023-41357-2023-02-24T10:52:21.413Z","CONTRATACIÓN DEL SERVICIO DE DISEÑO, DIAGRAMACIÓN E IMPRESIÓN DE PRODUCTOS COMUNICACIONALES EN DIVERSOS FORMATOS, PARA DIFUNDIR E INFORMAR SOBRE LOS PROGRAMAS Y PROYECTOS QUE DESARROLLA LA SECRETARÍA DE INCLUSIÓN SOCIAL PARA ATENDER A LOS GRUPOS DE ATENCIÓN PRIORITARIA EN EL DMQ","730204","","",""
"ocds-5wno2w-SIE-MDMQ-SN-004-2023-41357","SIE-MDMQ-SN-004-2023-41357-2023-02-24T10:52:21.290Z","CONTRATACIÓN DE MANTENIMIENTO PREVENTIVO Y CORRECTIVO INCLUIDO REPUESTOS DEL EQUIPO DE ESTERILIZACION A VAPOR DE  LA UMSN  SN","530813","","",""
"ocds-5wno2w-SIE-RE-09D19-02-2023-18608","SIE-RE-09D19-02-2023-18608-2023-02-24T10:52:21.794Z","ADQUISICIÓN DE MEDICAMENTOS PERTENECIENTES AL GRUPO ANATÓMICO C- SISTEMA CARDIOVASCULAR PARA EL PRIMER SEMESTRE 2023 PARA EL DISTRITO 09D19 DAULE-NOBOL-SANTA LUCÍA-SALUD","2023.320.1222.0000.90.00.000.004.000.0906.530809.000000.001.0000.0000","","",""
"ocds-5wno2w-SIE-RE-12D03-01-2023-560052","SIE-RE-12D03-01-2023-560052-2023-02-24T10:52:22.111Z","ADQUISICIÓN DE BIENES ESTRATÉGICOS DE LA SALUD DE USO GENERAL PARA ABASTECER LAS UNIDADES OPERATIVAS DE LA DIRECCIÓN DISTRITAL QUEVEDO - MOCACHE - BUENA FE - VALENCIA","2023.320.5450.0000.90.00.000.003.000.1205.530826.000000.001.0000.0000","","",""
"ocds-5wno2w-SIE-RE-HDC-004-2023-2804","SIE-RE-HDC-004-2023-2804-2023-02-24T10:52:22.127Z","ADQUISICIÓN DE INSULINA HUMANA NPH (ACCION INTERMEDIA) LIQUIDO PARENTERAL 100 UI/ML FRASCO X10ML PARA EL C.C.Q.A.H.D. COTOCOLLAO","530809","","",""
"ocds-5wno2w-SIE-NDSM-001-2023-185868","SIE-NDSM-001-2023-185868-2023-03-02T10:42:42.910Z-compiled","ADQUISICIÓN DE MATERIALES DE ASEO PARA ABASTECER EL STOCK DE LA BODEGA INSTITUCIONAL","9301001002","","",""
"ocds-5wno2w-SIE-RE-HDGDZ-05-2023-62010","SIE-RE-HDGDZ-05-2023-62010-2023-02-24T10:52:21.641Z","ADQUISICIÓN DE MEDICAMENTOS DEL GRUPO-B SOLIDOS ORALES Y LIQUIDOS PARENTERALES PARA ABASTECER EL HOSPITAL DR.  GUSTAVO DOMINGUEZ Z. DE LA CIUDAD DE SANTO DOMINGO","2023.320.1428.0000.90.00.000.003.000.2301.530809.000000.001.0000.0000","","",""
"ocds-5wno2w-SIE-RE-HDGDZ-06-2023-62010","SIE-RE-HDGDZ-06-2023-62010-2023-02-24T10:52:21.673Z","ADQUISICIÓN DE MEDICAMENTOS DEL GRUPO-C SOLIDOS ORALES Y LIQUIDOS PARENTERALES PARA ABASTECER EL HOSPITAL DR.  GUSTAVO DOMINGUEZ Z. DE LA CIUDAD DE SANTO DOMINGO","2023.320.1428.0000.90.00.000.003.000.2301.530809.000000.001.0000.0000","","",""
"ocds-5wno2w-SIE-RE-HEJCA-F-11-23-87497","SIE-RE-HEJCA-F-11-23-87497-2023-02-24T10:52:22.022Z","ADQUISICIÓN DE DUTASTERIDA SOLIDO ORAL 0.5 MG","530809","","",""
"ocds-5wno2w-SIE-RE-HEJCA-F-19-23-87497","SIE-RE-HEJCA-F-19-23-87497-2023-02-24T10:52:22.072Z","ADQUISICIÓN DE LEVETIRACETAM LIQUIDO ORAL 500 MG/5 ML","530809","","",""
"ocds-5wno2w-SIE-RE-HEJCA-F-21-23-87497","SIE-RE-HEJCA-F-21-23-87497-2023-02-24T10:52:03.844Z-compiled","ADQUISICION DE OXALIPLATINO SOLIDO PARENTERAL 100MG","530809","","",""
"ocds-5wno2w-SIE-RE-HEP-011-2023-889479","SIE-RE-HEP-011-2023-889479-2023-02-24T10:52:22.151Z","ADQUISICIÓN DEL MEDICAMENTO ESTIMULANTE CARDÍACO NOREPINEFRINA LIQUIDO PARENTERAL 4MG / 4ML (IV),  PARA DAR TRATAMIENTO EN PACIENTES DEL HOSPITAL DE ESPECIALIDADES PORTOVIEJO","2023.320.9004.0000.90.00.000.001.000.1301.530809.000000.001.0000.0000","","",""
"ocds-5wno2w-SIE-RE-HFIB-003-2023-29399","SIE-RE-HFIB-003-2023-29399-2023-02-24T10:52:21.770Z","ADQUISICIÓN DE DISPOSITIVOS MEDICOS VARIOS PARA CIRUGIA PARA EL HOSPITAL DEL NIÑO DR. FRANCISCO DE ICAZA BUSTAMANTE 2023","2023.320.1190.0000.90.00.000.004.000.0901.530826.000000.001.0000.0000","","",""
"ocds-5wno2w-SIE-RE-HGM-010-2023-57617","SIE-RE-HGM-010-2023-57617-2023-02-24T10:52:22.284Z","ADQUISICIÓN DE DISPOSITIVOS MÉDICOS PARA EL ÁREA DE LABORATORIO  CLINICO - ACTA DEL COMITÉ DE DISPOSITIVOS MÉDICOS NO. CDM-007-2022- 12-14","530810","","",""
"ocds-5wno2w-SIE-RE-HGM-012-2023-57617","SIE-RE-HGM-012-2023-57617-2023-02-24T10:52:22.145Z","ADQUISICIÓN DE GRUPO A DE REACTIVOS PARA EL ÁREA DE QUÍMICA E  INMUNOLOGIA - ACTA DEL COMITÉ DE DISPOSITIVOS MÉDICOS NO. CDM-007-2022- 12-14","530810","","",""
"ocds-5wno2w-SIE-RE-HGNGC-002-23-818925","SIE-RE-HGNGC-002-23-818925-2023-02-24T10:52:22.211Z","ADQUISICION DE MEDICAMENTOS: GRUPO M: SISTEMA MÚSCULO ESQUELÉTICO PARA EL HOSPITAL GENERAL DEL NORTE DE GUAYAQUIL LOS CEIBOS","530809","","",""
"ocds-5wno2w-SIE-RE-HGONA-003-23-730708","SIE-RE-HGONA-003-23-730708-2023-02-24T10:52:21.922Z","ADQUISICION DE DISPOSITIVOS MEDICOS BALON  INTRAUTERINO DE BAKRI PARA EL HOSPITAL GINECO  OBSTÉTRICO  PEDIÁTRICO  DE  NUEVA  AURORA  LUZ  ELENA  ARISMENDI","2023.320.9002.0000.90.00.000.005.000.1701.530826.000000.001.0000.0000","","",""
"ocds-5wno2w-SIE-RE-HGONA-004-23-730708","SIE-RE-HGONA-004-23-730708-2023-02-24T10:52:22.123Z","ADQUISICION DE DISPOSITIVOS MEDICOS INDICADORES DE ESTERILIDAD DE CENTRAL DE ESTERILIZACIÓN PARA EL HOSPITAL GINECO OBSTÉTRICO PEDIÁTRICO DE NUEVA AURORA LUZ ELENA ARISMENDI","2023.320.9002.0000.90.00.000.005.000.1701.530826.000000.001.0000.0000","","",""
"ocds-5wno2w-SIE-RE-HGONA-005-23-730708","SIE-RE-HGONA-005-23-730708-2023-02-24T10:52:22.087Z","ADQUISICION DE CONTENEDOR PARA OBJETOS CORTOPUNZANTES, 2900 - 3000 ML PARA EL HOSPITAL GINECO OBSTÉTRICO PEDIÁTRICO DE NUEVA AURORA “LUZ ELENA ARISMENDI”","2023.320.9002.0000.90.00.000.005.000.1701.530826.000000.001.0000.0000","","",""
"ocds-5wno2w-SIE-RE-HGQ-005-2023-782624","SIE-RE-HGQ-005-2023-782624-2023-02-24T10:52:22.169Z","ADQUISICIÓN DE LOS MEDICAMENTOS NO CATALOGADOS (GRUPO C) SISTEMA CARDIOVASCULAR PARA EL HOSPITAL GENERAL QUEVEDO","530809","","",""
"ocds-5wno2w-SIE-RE-HGQ-006-2023-782624","SIE-RE-HGQ-006-2023-782624-2023-02-24T10:52:22.221Z","ADQUISICIÓN DE LOS MEDICAMENTOS NO CATALOGADOS (GRUPO A) TRACTO ALIMENTARIO Y METABOLISMO PARA EL HOSPITAL GENERAL QUEVEDO","530809","","",""
"ocds-5wno2w-SIE-SBEP-001-2023-414618","SIE-SBEP-001-2023-414618-2023-02-24T10:52:21.612Z","ADQUISICION DE EQUIPO ROBOCOP ANTIMOTIN","631006","","",""
"ocds-5wno2w-SIE-UNEMI-586-2023-43664","SIE-UNEMI-586-2023-43664-2023-02-24T10:52:21.750Z","ADQUISICIÓN DE INSUMOS QUÍMICOS Y HERRAMIENTAS PARA EL MANTENIMIENTO DE LAS ÁREAS VERDES DE LA UNIVERSIDAD ESTATAL DE MILAGRO","2023.181.0000.0000.01.00.000.001.000.0910.530814.000000.001.0000.0000","","",""
"ocds-5wno2w-CDC-EPMTT-001-2023-706983","CDC-EPMTT-001-2023-706983-2023-02-25T11:01:00.903Z","CONSULTORÍA PARA RENOVACIÓN  DE LICENCIA DE PROGRAMA PUNIS PARA LA EPM-GESTITRANSV-T","530702","","440.00","USD"
"ocds-5wno2w-CDC-GADC-18171-2023-2616","CDC-GADC-18171-2023-2616-2023-02-25T11:01:02.429Z","Estudio y elaboración del Atlas de la biodiversidad del cantón Cuenca y establecimiento de potenciales biocorredores urbanos y su funcionalidad","7.3.32.3.06.05.01","","26785.71","USD"
"ocds-5wno2w-CDC-GADPRC-1-2023-112457","CDC-GADPRC-1-2023-112457-2023-02-25T11:01:02.021Z","ESTUDIO DEFINITIVO PARA LA REGENERACION  URBANA DE LOS ACCESOS DE LA PARROQUIA CAMPOZANO (ACCESO 1 DESDE EL SECTOR CAMPOZANO  NORTE HASTA LA ALTURA DE LA CANCHA CUBIERTA  MILTON GREGORIO MARTINEZ, ACCESO 2 DESDE LA  COMUNIDAD LA UNION HASTA EL PUENTE ROTO Y  ACCESO 3 DESDE LA CALLE SEGUNDO PACIFICO ACEBO,  HASTA EL SECTOR SAN JOSE","73.06.01","","29500.00","USD"
"ocds-5wno2w-CDC-GADMN-002-2023-30549","CDC-GADMN-002-2023-30549-2023-02-25T11:01:02.334Z","SERVICIO ESPECIALIZADO DE ASISTENCIA TÉCNICA Y CAPACITACIÓN PARA EL FORTALECIMIENTO CULTURAL EN MUSICA Y DANZA FOLCLORICA ESCUELA DE ARTES NABON","21073061300399999900","","8000.00","USD"
"ocds-5wno2w-CDC-GADMS-004-2023-202671","CDC-GADMS-004-2023-202671-2023-02-25T11:01:02.205Z","FISCALIZACIÓN EXTERNA PARA LA OBRA CONSTRUCCIÓN DEL PARQUE CENTRAL PRIMERA FASE DE LA COMUNIDAD COCHA SECA PERTENECIENTE A LA PARROQUIA EL PLAYÓN DE SAN FRANCISCO","341.7.3.06.01","","13224.36","USD"
"ocds-5wno2w-CDC-GADMY-001-2023-38149","CDC-GADMY-001-2023-38149-2023-02-25T11:00:52.837Z-compiled","ESTUDIOS ELÉCTRICOS PARA EL PLAN MAESTRO DE AGUA POTABLE, ALCANTARILLADO SANITARIO Y ALCANTARILLADO PLUVIAL DE LA CIUDAD DE YANTZAZA","7.3.06.05.03","","17849.83","USD"
"ocds-5wno2w-CDC-GADPLV-0012023-243034","CDC-GADPLV-0012023-243034-2023-02-25T11:01:02.449Z","FISCALIZACION PARA PAVIMENTACIÓN ASFÁLTICA EN LA CALLE ENRIQUE DECKER DESDE LA CALLE A HASTA CALLE H DE LA CABECERA PARROQUIAL LA VICTORIA DEL CANTON SALITRE","7.3.06.04","","9535.86","USD"
"ocds-5wno2w-CDC-GMCM-003-2023-2689","CDC-GMCM-003-2023-2689-2023-02-25T11:01:02.345Z","ACTUALIZACIÓN DEL ESTUDIO DEL SISTEMA DE AGUA POTABLE REGIONAL SAN ANTONIO DE QUILAMUPI QUE COMPRENDE LAS COMUNIDADES SANTA MARIA DE TUNANTS, WUAPU, LOS CANELOS, SAN ANTONIO DE QUILAMUPI, SAN PEDRO Y SAN VICENTE, PERTENECIENTE A LA PARROQUIA SEVILLA DON BOSCO CANTÓN MORONA.","331.14.01.73.06.05","","57178.30","USD"
"ocds-5wno2w-CDC-IACBP-001-2023-85808","CDC-IACBP-001-2023-85808-2023-02-25T11:01:02.460Z","ESTUDIO DE INGENIERIA PARA CONCESIÓN DE FRECUENCIAS TEMPORALES Y DEFINITIVAS EN VHF 2 VIAS","530601002","","3800.00","USD"
"ocds-5wno2w-CDC-MPORTO-003-2023-2332","CDC-MPORTO-003-2023-2332-2023-02-25T11:01:02.296Z","ESTUDIOS PARA SERVICIOS DE LEVANTAMIENTO TOPOGRAFICO DE TERRENO PARA EL CIAL","2023.31.09.B300.312.730601.000.13.01.000.0.000","","11998.98","USD"
"ocds-5wno2w-COTB-GADMCN-01-23-67188","COTB-GADMCN-01-23-67188-2023-02-25T11:01:02.550Z","ADQUISICIÓN DE COMBUSTIBLE PARA LOS VEHICULOS, MAQUINARIAS Y EQUIPOS PERTENECIENTES AL GAD MUNICIPAL DEL CANTON NARANJAL","730803","","150439.73","USD"
"ocds-5wno2w-COTO-GADIPCS-2023-02-54077","COTO-GADIPCS-2023-02-54077-2023-02-25T11:01:01.940Z","CONSTRUCCIÓN DE LA AMPLIACIÓN Y REMODELACIÓN DEL MERCADO MUNICIPAL DEL CANTÓN SUSCAL, PROVINCIA DEL CAÑAR","361.75.01.07.25","","787857.40","USD"
"ocds-5wno2w-COTO-GADMCG-0001-23-12403","COTO-GADMCG-0001-23-12403-2023-02-25T11:01:02.605Z","“CONSTRUCCIÓN DEL ALCANTARILLADO, CARPETA ASFÁLTICA, DE LA VÍA BULLCAY-BULLZHÚN (RUTA DE LA MACANA ETAPA 2) DEL CANTÓN GUALACEO”.","03.03.000.360.750105.104.01.03.000.00000000.000","","758212.61","USD"
"ocds-5wno2w-COTO-GADMCP-01-2023-94782","COTO-GADMCP-01-2023-94782-2023-02-25T11:01:02.612Z","MEJORAMIENTO DE LOS ESPACIOS PUBLICOS MEDIANTE LA CONSTRUCCIÓN DEL PARQUE DE LA FAMILIA DE LA PARROQUIA MATUS, CANTON PENIPE, PROVINCIA CHIMBORAZO","7.5.01.04.30.05.05","","721126.69","USD"
"ocds-5wno2w-COTO-GADMY-003-2023-38149","COTO-GADMY-003-2023-38149-2023-02-25T11:01:02.058Z","CONSTRUCCIÓN DE LA INFRAESTRUCTURA DEPORTIVA PARA EL ÁREA RURAL DEL CANTÓN YANTZAZA: COMUNIDADES LOS ALMENDROS, ANKUASH Y WAMBASH","7.5.01.07.61","","303238.79","USD"
"ocds-5wno2w-RE-GADMP-01-2023-96177","RE-GADMP-01-2023-96177-2023-02-25T11:00:03.922Z-compiled","CONTRATACIÓN DE SERVICIOS DE PRESENTACIÓN DE DANZAS, ARTÍSTAS, BANDA MUSICAL DE PUEBLO, PARA LA EJECUCIÓN DE ACTIVIDADES PARA EL FORTALECIMIENTO Y PROMOCIÓN CULTURAL Y TURÍSTICA CARNAVAL PALLATANGA 2023","7.3.02.05.24","","10300.00","USD"
"ocds-5wno2w-COTO-GADMY-004-2023-38149","COTO-GADMY-004-2023-38149-2023-02-25T11:01:02.318Z","CONSTRUCCIÓN DEL BLOQUE DE AULAS, BATERÍA SANITARIA, CANCHA Y CUBIERTA DE USO MÚLTIPLE DE LA ESCUELA DE EDUCACIÓN BÁSICA JUAN PIO MONTUFAR, CANTÓN YANTZAZA, PROVINCIA DE ZAMORA CHINCHIPE","7.5.01.07.62","","275084.01","USD"
"ocds-5wno2w-COTO-MDMQCOM-02-2023-41357","COTO-MDMQCOM-02-2023-41357-2023-02-25T11:01:02.533Z","REMODELACIÓN MERCADO ARENAL COM","750107","","288980.12","USD"
"ocds-5wno2w-COTS-ELEPCO-001-2023-32043","COTS-ELEPCO-001-2023-32043-2023-02-25T11:01:02.561Z","SERVICIO DE MANTENIMIENTO MENOR DE LAS CENTRALES DE GENERACIÓN DE ELEPCO S.A.","5120201.5210201.5220201","","158414.17","USD"
"ocds-5wno2w-COTS-GADPPz-001-2023-24084","COTS-GADPPz-001-2023-24084-2023-02-25T11:01:02.080Z","Contratación de servicio de organización, coordinación y ejecución de las efemérides de las parroquias Curaray, Madre Tierra, Shell, 10 de agosto, Canelos, El triunfo, Fátima, Montalvo, Pomona, Sarayacu, Simón Bolívar, Veracruz, Teniente Hugo Ortiz, San José de la Provincia de Pastaza 2023, para fomentar los valores, costumbres propias de nuestra cultura, e impulsar el turismo, difundiendo los recursos turísticos y dinamizar la economía local","410.730205","","140000.00","USD"
"ocds-5wno2w-COTS-PGE-UAM-01-2023-2503","COTS-PGE-UAM-01-2023-2503-2023-02-25T11:01:02.422Z","Contratación de una Agencia de Viajes para la provisión de pasajes aéreos nacionales e  internacionales para la Procuraduría General del Estado","2023.590.9999.0000.01.00.000.001.000.1701.530302.000000.001.0000.0000","","67294.40","USD"
"ocds-5wno2w-COTS-SM-002-2023-62409","COTS-SM-002-2023-62409-2023-02-25T11:01:02.238Z","CONTRATACIÓN DE UNA ESTACIÓN DE COMBUSTIBLE PARA ABASTECER A LOS VEHÍCULOS Y MOTOCICLETAS DEL DISTRITO CHONE SUBZONA DE POLICÍA MANABÍ No. 13","2023.052.0051.0000.01.00.000.001.000.1301.530255.000000.001.0000.0000","","69751.32","USD"
"ocds-5wno2w-COTS-SZX-01-2023-179100","COTS-SZX-01-2023-179100-2023-02-25T11:01:02.260Z","CONTRATACIÓN DE UNA ESTACIÓN DE SERVICIO DE COMBUSTIBLE PARA EL PARQUE AUTOMOTOR DE LA SUBZONA COTOPAXI (DISTRITO LATACUNGA, DANZANTE Y SERVICIOS)","2023.052.0033.0000.01.00.000.001.000.0501.530255.000000.001.0000.0000","","223398.06","USD"
"ocds-5wno2w-LCC-EENORTE-010-2023-3243","LCC-EENORTE-010-2023-3243-2023-02-25T11:01:02.710Z","ESTUDIO DE DISEÑO DE LA LÍNEA DE SUBTRANSMISIÓN DE 69 KV ALPACHACA-TULCÁN","5210210","","352000.00","USD"
"ocds-5wno2w-RE-GADPRPM-01-2023-152074","RE-GADPRPM-01-2023-152074-2023-02-25T11:01:02.536Z","?ADQUISICIÓN DE REPUESTOS Y ACCESORIOS PARA RETROEXCAVADORA JOHN DEERE, PROPIEDAD DEL GAD PARROQUIAL RURAL PUERTO MURIALDO?","73.08.13","","25077.05","USD"
"ocds-5wno2w-RE-HG-INT-001-2023-134008","RE-HG-INT-001-2023-134008-2023-02-25T11:01:01.164Z","CONTRATACIÓN DEL SERVICIO DE INTERNET PARA EL HOSPITAL BÁSICO AIDA LEÓN DE RODRÍGUEZ LARA – AÑO 2023.","2023.320.1020.0000.90.00.000.004.000.0102.530255.000000.001.0000.0000-","","6515.04","USD"
"ocds-5wno2w-RE-OACL-GADMSR-01-23-38391","RE-OACL-GADMSR-01-23-38391-2023-02-25T11:00:15.793Z-compiled","ORGANIZACIÓN Y EJECUCION DE CARAVANAS TURISTICAS, ARTISTICAS Y CULTURALES PARA INCENTIVAR EL TURISMO EN FERIADO DE CARNAVAL 2023 EN EL CANTON SANTA ROSA, PROVINCIA DE EL ORO","311.73.02.49","","31250.00","USD"
"ocds-5wno2w-SIE-006-GADPLN-2023-92071","SIE-006-GADPLN-2023-92071-2023-02-25T11:01:02.034Z","ADQUISICIÓN DE  MATERIALES DE CONSTRUCCIÓN PARA  LA INTERVENCIÓN EN ESPACIOS PÚBLICOS DE LA PARROQUIA LAS NIEVES, CANTÓN NABÓN, PROVINCIA DEL AZUAY","730811","","",""
"ocds-5wno2w-SIE-CZ3INEC-001-2023-393067","SIE-CZ3INEC-001-2023-393067-2023-02-25T11:01:02.642Z","CONTRATACIÓN DEL SERVICIO DE TRANSPORTE INSTITUCIONAL PARA FACILITAR LA MOVILIZACIÓN DE LAS Y LOS SERVIDORES PÚBLICOS A LAS HORAS DE ENTRADA Y SALIDA DE LAS JORNADAS DE TRABAJO, NECESARIO PARA EL DESARROLLO DE LAS ACTIVIDADES DE LA COORDINACION ZONAL 3 INEC CORRESPONDIENTE AL PERIODO MARZO – NOVIEMBRE DE 2023","2023.064.0003.0000.01.00.000.001.000.1801.530201.000000.001.0000.0000","","",""
"ocds-5wno2w-SIE-DD11D03-002-2023-18841","SIE-DD11D03-002-2023-18841-2023-02-25T11:00:13.226Z-compiled","CONTRATACIÓN DEL SERVICIO DE LIMPIEZA DE LAS AREAS ASISTENCIALES, ADMINISTRATIVAS, GENERALES Y AREAS VERDES DEL CENTRO DE SALUD TIPO C CATAMAYO PERTENECIENTE A LA DIRECCIÓN DISTRITAL 11D03 PALTAS-CATAMAYO- CHAGUARPAMBA-OLMEDO-SALUD","2023.320.1278.0000.90.00.000.001.000.1109.530209.000000.001.0000.0000","","",""
"ocds-5wno2w-SIE-03D03-008-2023-8574","SIE-03D03-008-2023-8574-2023-02-25T11:01:02.507Z","ADQUISICIÓN DE DISPOSITIVOS MÉDICOS DE USO GENERAL  EQUIPOS DE INFUSIÓN PARA BOMBA PARA EL HOSPITAL DARIO MACHUCA PALACIOS DE LA  DIRECCIÓN DISTRITAL 03D03 TRONCAL-SALUD.","2023.320.1055.0000.90.00.000.001.000.0304.530826.000000.001.0000.0000","","",""
"ocds-5wno2w-SIE-09D14-001-2023-101441","SIE-09D14-001-2023-101441-2023-02-25T11:01:01.307Z","ADQUISICIÓN DE DISPOSITIVOS MEDICOS DE USO GENERAL PARA ABASTECIMIENTO DEL AÑO 2023 EN LOS ESTABLECIMIENTOS DE SALUD DEL DISTRITO 09D14","2023.320.1223.0000.90.00.000.001.000.0914.530826.000000.001.0000.0000","","",""
"ocds-5wno2w-SIE-09D14-002-2023-101441","SIE-09D14-002-2023-101441-2023-02-25T11:01:01.667Z","ADQUISICIÓN DE MEDICAMENTOS VITALES Y ESENCIALES GRUPO TERAPEUTICO J ANTIINFECCIOSOS QUE NO CONSTAN EN CATALOGO ELECTRONICO","2023.320.1223.0000.90.00.000.001.000.0914.530809.000000.001.0000.0000","","",""
"ocds-5wno2w-SIE-CECG-002-2023-2739","SIE-CECG-002-2023-2739-2023-02-25T11:00:37.769Z-compiled","ADQUISICIÓN DE FARMACOS GRUPO TERAPEUTICO A PARA LA UNIDAD DE FARMACIA DEL CENTRO DE ESPECIALIDADES CENTRAL GUAYAS","530809","","",""
"ocds-5wno2w-SIE-CMFIEDM-007-2023-748941","SIE-CMFIEDM-007-2023-748941-2023-02-25T11:01:02.156Z","ALOPURINOL SÓLIDO ORAL 300 MG CAJA X  BLÍSTER/RISTRA","530809","","",""
"ocds-5wno2w-SIE-GADMCA-03-2023-3680","SIE-GADMCA-03-2023-3680-2023-02-25T11:01:02.148Z","CONTRATACIÓN DEL SERVICIO PARA FORMACIÓN DE ORADORES ESTUDIANTILES PARA POTENCIALIZAR LAS TRADICIONES Y EXPRESIONES ORALES EN BENEFICIO DEL RESCATE DE LA MEMORIA HISTÓRICA CULTURAL Y PATRIMONIO ORAL, A TRAVÉS DE CAPACITACIONES A LOS ESTUDIANTES DEL SEGUNDO Y TERCERO DE BACHILLERATO DE LAS UNIDADES EDUCATIVAS DEL CANTÓN ALAUSÍ Y SUS PARROQUIAS.","73.06.13.2023.220.007.004.002","","",""
"ocds-5wno2w-SIE-DDS18D04-03-2023-2733","SIE-DDS18D04-03-2023-2733-2023-02-25T11:01:02.051Z","ADQUISICIÓN  NC. DISPOSITIVOS MÉDICOS PARA EL SERVICIO DE ODONTOLOGÍA PARA EL DISTRITO 18D04 PATATE - SAN PEDRO DE PELILEO","2023.320.1465.0000.90.00.000.001.000.1807.530832.000000.001.0000.0000","","",""
"ocds-5wno2w-SIE-DDS18D04-04-2023-2733","SIE-DDS18D04-04-2023-2733-2023-02-25T11:01:02.055Z","ADQUISICIÓN NC. MEDICAMENTOS NO CATALOGADOS DEL GRUPO TERAPÉUTICO M (SISTEMA MUSCULO ESQUELÉTICO)  PARA EL DISTRITO 18D04 PATATE - SAN PEDRO DE PELILEO","2023.320.1465.0000.90.00.000.001.000.1807.530809.000000.001.0000.0000","","",""
"ocds-5wno2w-SIE-DDS18D04-05-2023-2733","SIE-DDS18D04-05-2023-2733-2023-02-25T11:01:02.043Z","ADQUIRIR NC. MEDICAMENTOS NO CATALOGADOS DEL GRUPO TERAPÉUTICO A TRACTO ALIMENTARIO Y METABOLICO PARA EL DISTRITO 18D04 PATATE - SAN PEDRO DE PELILEO","2023.320.1465.0000.90.00.000.001.000.1807.530809.000000.001.0000.0000","","",""
"ocds-5wno2w-SIE-DDS18D04-06-2023-2733","SIE-DDS18D04-06-2023-2733-2023-02-25T11:01:02.490Z","ADQUIRIR NC. MEDICAMENTOS NO CATALOGADOS INSULINA HUMANA NPH ACCION INTERMEDIA LIQUIDO PARENTERAL 100 UI ML PARA EL DISTRITO 18D04 PATATE - SAN PEDRO DE PELILEO","2023.320.1465.0000.90.00.000.001.000.1807.530809.000000.001.0000.0000","","",""
"ocds-5wno2w-SIE-GADMCM-02-2023-2742","SIE-GADMCM-02-2023-2742-2023-02-25T11:00:24.924Z-compiled","ADQUISICIÓN DE IMPLEMENTOS DEPORTIVOS PARA EL APOYO AL DEPORTISTA DEL CANTÓN MEJÍA","53.14.08","","",""
"ocds-5wno2w-SIE-DDSG1-002-2023-128799","SIE-DDSG1-002-2023-128799-2023-02-25T11:01:02.005Z","CONTRATACIÓN DEL SERVICIO DE GESTIÓN INTEGRAL DE DESECHOS  PARA LA DIRECCION DISTRITAL 09D01- XIMENA 1- PARROQUIA RURAL:  PUNÁ-ESTUARIO DEL RÍO GUAYAS – SALUD","2023.320.1198.0000.90.00.000.001.000.0901.530209.000000.001.0000.0000","","",""
"ocds-5wno2w-SIE-DHQ-INSU-01-2023-20291","SIE-DHQ-INSU-01-2023-20291-2023-02-25T11:01:01.240Z","ADQUISICIÓN DE RESPIRADOR CON EFICIENCIA DE FILTRACIÓN MÍNIMA DEL 95por ciento QUIRÚRGICO CON MASCARILLA DE FILTRADO PARA SER UTILIZADOS EN LA ATENCIÓN DE PACIENTES, PERSONAL DE SALUD Y ADMINISTRATIVO, QUE SE ENCUENTRAN EN LAS DIFERENTES ÁREAS DE LA DIRECCIÓN HOSPITALARIA QUITO","2023.058.0001.0000.91.00.000.001.000.1701.530826.000000.002.0000.0000","","",""
"ocds-5wno2w-SIE-DT-UEM-001-2023-316213","SIE-DT-UEM-001-2023-316213-2023-02-25T11:01:02.493Z","ADQUISICIÓN INSTALACIÓN Y PUESTA EN MARCHA DE VÁLVULAS MARIPOSA CON ACTUADOR AUTOMÁTICO PARA LA PTAP CARANQUI DE LA EMAPA-I","8.4.01.04","","",""
"ocds-5wno2w-SIE-EERCS-009-2023-56835","SIE-EERCS-009-2023-56835-2023-02-25T11:01:02.403Z","SERVICIOS DE GESTIÓN DE CARTERA VENCIDA A TRAVÉS DE NOTIFICACIÓN, SUSPENSIÓN, RECONEXIÓN Y RETIRO DEL SERVICIO DE ENERGÍA ELÉCTRICA EN EL ÁREA DE COBERTURA DE LA ZONA 3 -2023 - AGENCIAS: GIRÓN, NABÓN Y SANTA ISABEL","52100400100100274","","",""
"ocds-5wno2w-SIE-EMAIMEP-03-2023-827527","SIE-EMAIMEP-03-2023-827527-2023-02-25T11:01:02.581Z","“SERVICIO DE ALQUILER DE VOLQUETA DE 8M3 Y MAQUINARIA TIPO RETROEXCAVADORA DE 95 HP, PARA EL DESALOJO DE VERTEDEROS CLANDESTINO EN EL CANTÓN MONTECRISTI”","7.3.05.05","","",""
"ocds-5wno2w-SIE-EPEMAPAG-01-2023-332171","SIE-EPEMAPAG-01-2023-332171-2023-02-25T11:01:02.193Z","ADQUISICIÓN DE TUBERÍAS PARA LA CONSTRUCCIÓN DE PROYECTOS DE AGUA POTABLE Y EXTENSIONES DE RED DE ALCANTARILLADO","6.3.08.11","","",""
"ocds-5wno2w-SIE-EPMAPASD-02-2023-273847","SIE-EPMAPASD-02-2023-273847-2023-02-25T11:01:02.288Z","ADQUISICION DE QUIMICOS PARA LAS PLANTAS DE AGUA POTABLE COMO CLORO GAS","330.631005","","",""
"ocds-5wno2w-SIE-EPMMM-003-23-452218","SIE-EPMMM-003-23-452218-2023-02-25T11:00:47.596Z-compiled","ADQUISICION DE LLANTAS Y TUBOS QUE NO CONSTAN EL CATALOGO ELECTRONICO PARA MOTOCICLETAS Y UN CAMION DE LA EMPRESA PUBLICA MUNICIPAL MOVILIDAD DE MANTA EP","01.01.01.02 .2022.530813.001.D51 .99.99.99 .99.002","","",""
"ocds-5wno2w-SIE-ESPAM-01-2023-25643","SIE-ESPAM-01-2023-25643-2023-02-25T11:01:02.274Z","ADQUISICIÓN DE SILLAS DE MATERIAL PLÁSTICO REFORZADO, SIN APOYA BRAZOS, COLOR CAFÉ PARA LAS AULAS DE LAS DIFERENTES CARRERAS DE LA ESPAM MFL","2023.188.0000.0000.82.00.000.001.000.1302.531403.000000.001.0000.0000","","",""
"ocds-5wno2w-SIE-ESPOCH-01-2023-53390","SIE-ESPOCH-01-2023-53390-2023-02-25T11:01:02.098Z","RENOVACIÓN DEL LICENCIAMIENTO DE MICROSOFT A TRAVÉS DEL CAMPUS AGREEMENT PARA LA INSTITUCIÓN DURANTE 3 AÑOS (2023, 2024 y 2025)","2023.163.9999.0000.01.00.000.001.000.0601.530702.000000.002.7001.0006","","",""
"ocds-5wno2w-SIE-FAME-004-2023-510646","SIE-FAME-004-2023-510646-2023-02-25T11:00:40.272Z-compiled","ADQUISICIÓN DE MEDIAS PARA FAME S.A.","2111010101","","",""
"ocds-5wno2w-SIE-FG-001-2023-71731","SIE-FG-001-2023-71731-2023-02-25T11:01:02.357Z","SERVICIO DE IMPRESIÓN, ESCANEO Y FOTOCOPIADO DE DOCUMENTOS PARA LA FISCALÍA DEL GUAYAS","2023.598.0009.0000.01.00.000.001.000.0901.530204.000000.001.0000.0000","","",""
"ocds-5wno2w-SIE-FI-202-0001-72083","SIE-FI-202-0001-72083-2023-02-25T11:00:13.544Z-compiled","SERVICIO DE OUTSOURCING IMPRESIÓN, COPIAS, SCANER DEPENDENCIAS DE LA FISCALÍA DE IMBABUBRA","2023.598.0010.0000.01.00.000.001.000.1001.530204.000000.001.0000.0000","","",""
"ocds-5wno2w-SIE-GADCHI-01-2023-105487","SIE-GADCHI-01-2023-105487-2023-02-25T11:01:00.611Z","ADQUISICION DE INSUMOS PARA EL FORTALECIMIENTO AL DESARROLLO  PRODUCTIVO DE LAPARROQUIA CHIQUINTAD DEL CANTON CUENCA","730814","","",""
"ocds-5wno2w-SIE-GADMANTA-04-23-2668","SIE-GADMANTA-04-23-2668-2023-02-25T11:01:02.625Z","CONTRATACIÓN DE SERVICIO DE MANTENIMIENTO INTEGRAL PARA EQUIPOS DE REHABILITACIÓN Y TERAPIAS FÍSICAS DE LA UNIDAD DE ATENCIÓN ESPECIALIZADA EN SALUD DEL PATRONATO MUNICIPAL DE AMPARO SOCIAL DE MANTA","730404","","",""
"ocds-5wno2w-SIE-GADMCMM-2023-001-107336","SIE-GADMCMM-2023-001-107336-2023-02-25T11:01:02.126Z","CONTRATACIÓN DE SERVICIO DE INTERNET PARA VARIOS EDIFICIOS DEL GAD MUNICIPAL DEL CANTÓN CRNEL MARCELINO MARIDUEÑA","5.3.01.05","","",""
"ocds-5wno2w-SIE-GADMCPQ-001-2023-2466","SIE-GADMCPQ-001-2023-2466-2023-02-25T11:01:02.527Z","SERVICIO DE MOVILIZACIÓN PARA PROMOTORES SOCIALES PARA EL SERVICIO DE ADULTO MAYOR CON DISCAPACIDAD","78.01.08","","",""
"ocds-5wno2w-SIE-GADMCS-04-2023-57127","SIE-GADMCS-04-2023-57127-2023-02-25T11:01:02.281Z","ADQUISICION DE INSECTICIDAS PARA EL PROGRAMA AMBIENTAL DE SERVICIO DE LIMPIEZA, DESINFECCION Y FUMIGACION INTRA DOMICILIARIA DE LA PARROQUIA LA PUNTILLA","7.3.08.19","","",""
"ocds-5wno2w-SIE-GADMCSB-01-2023-28501","SIE-GADMCSB-01-2023-28501-2023-02-25T11:01:02.675Z","CONTRATACION DEL SERVICIO DE MANTENIMIENTO TÉCNICO DE LOS RECURSOS TECNOLÓGICOS, RED DE FIBRA ÓPTICA, CÁMARAS Y DATA CENTER","750504","","",""
"ocds-5wno2w-SIE-GADMCSL-002-2023-100696","SIE-GADMCSL-002-2023-100696-2023-02-25T11:00:42.059Z-compiled","ADQUISICIÓN DE 15.000 METROS CÚBICOS DE MATERIAL DE PRÉSTAMO IMPORTADO PARA EL MANTENIMIENTO DE VARIAS CALLES DE LOS SECTORES RURALES Y URBANOS DEL CANTÓN SANTA LUCÍA","730811","","",""
